{

  "schemaVersion": "1.0",

  "requestId": "rr-cecp-engine3d-cinematic",

  "intentId": "intent-cecp-cinematic-quality-engine3d",

  "worldId": "world-mythar-ascension-cinematic",

  "timelineId": "timeline-cecp-cinematic-quality",

  "timeSeconds": 0,

  "parameters": {

    "purpose": "cinematic-render-quality",

    "cinematicPrompt": "Engine3D soft-raster structure plate — shaded spheres, readable form",

    "stage": "RenderRequest→engine3d-world",

    "qualityLadder": "cinematic"

  },

  "provenance": {

    "promptSpecHash": "sha256:cecpcinematicprompt0000000000003",

    "renderIntentHash": "sha256:cecpcinematicintent0000000000003",

    "source": "fixture-sf-output"

  },

  "payload": {

    "route": "engine3d-world",

    "render": {

      "width": 512,

      "height": 512,

      "samples": 2,

      "maxDepth": 3,

      "seed": 42,

      "quality": "cinematic"

    },

    "engine3dWorldDocument": {

      "id": "cecp-engine3d-star",

      "schemaVersion": "1.0",

      "kind": "Engine3DWorldDocument",

      "camera": {

        "id": "cam-main",

        "eye": [0.15, 0.85, 4.0],

        "lookAt": [0, 0.25, 0],

        "up": [0, 1, 0],

        "fovY": 0.78,

        "near": 0.1,

        "far": 40,

        "exposure": 1.2

      },

      "primitives": [

        {

          "id": "core",

          "type": "sphere",

          "center": [0, 0.25, 0],

          "radius": 0.58,

          "color": [0.28, 0.82, 1.0],

          "material": {

            "kind": "standard",

            "baseColor": [0.28, 0.82, 1.0],

            "metallic": 0.15,

            "roughness": 0.35

          }

        },

        {

          "id": "arm-0",

          "type": "sphere",

          "center": [1.45, 0.22, 0.12],

          "radius": 0.24,

          "color": [1.0, 0.52, 0.18],

          "material": {

            "kind": "standard",

            "baseColor": [1.0, 0.52, 0.18],

            "metallic": 0.05,

            "roughness": 0.45

          }

        },

        {

          "id": "arm-1",

          "type": "sphere",

          "center": [-1.25, 0.18, -0.22],

          "radius": 0.22,

          "color": [0.42, 0.95, 0.48],

          "material": {

            "kind": "standard",

            "baseColor": [0.42, 0.95, 0.48],

            "metallic": 0.05,

            "roughness": 0.5

          }

        },

        {

          "id": "arm-2",

          "type": "sphere",

          "center": [0.2, 0.15, 1.35],

          "radius": 0.18,

          "color": [0.95, 0.85, 0.35],

          "material": {

            "kind": "standard",

            "baseColor": [0.95, 0.85, 0.35],

            "metallic": 0.1,

            "roughness": 0.4

          }

        },

        {

          "id": "ground",

          "type": "plane",

          "center": [0, -0.35, 0],

          "normal": [0, 1, 0],

          "color": [0.08, 0.09, 0.11],

          "material": {

            "kind": "standard",

            "baseColor": [0.08, 0.09, 0.11],

            "metallic": 0,

            "roughness": 0.9

          }

        }

      ]

    }

  }

}

